{
  "$schema": "https://raw.githubusercontent.com/fedarovich/qbittorrent-cli/master/src/QBittorrent.CommandLineInterface/Schemas/colors-schema.json",
  "normal": {
    "bg": "system-bg",
    "fg": "system-fg"
  },
  "strong": {
    "bg": "system-bg",
    "fg": "dark-blue",
    "fg-alt": "yellow"
  },
  "warning": {
    "bg": "system-bg",
    "fg": "dark-yellow",
    "fg-alt": "yellow"
  },
  "active": {
    "bg": "system-bg",
    "fg": "dark-green",
    "fg-alt": "cyan"
  },
  "inactive": {
    "bg": "system-bg",
    "fg": "gray",
    "fg-alt": "dark-gray"
  },
  "log": {
    "status-normal": {
      "bg": "system-bg",
      "fg": "dark-green",
      "fg-alt": "green"
    },
    "status-info": {
      "bg": "system-bg",
      "fg": "dark-blue",
      "fg-alt": "blue"
    },
    "status-warning": {
      "bg": "system-bg",
      "fg": "dark-yellow",
      "fg-alt": "yellow"
    },
    "status-critical": {
      "bg": "system-bg",
      "fg": "red",
      "fg-alt": "dark-red"
    },
    "timestamp": {
      "bg": "system-bg",
      "fg": "dark-cyan",
      "fg-alt": "dark-cyan"
    },
    "message": {
      "bg": "system-bg",
      "fg": "black",
      "fg-alt": "dark-gray"
    }
  },
  "torrent-status": {
    "allocating": {
      "bg": "system-bg",
      "fg": "dark-green",
      "fg-alt": "green"
    },
    "checking-download": {
      "bg": "system-bg",
      "fg": "dark-yellow",
      "fg-alt": "yellow"
    },
    "checking-resume-data": {
      "bg": "system-bg",
      "fg": "dark-yellow",
      "fg-alt": "yellow"
    },
    "checking-upload": {
      "bg": "system-bg",
      "fg": "dark-yellow",
      "fg-alt": "yellow"
    },
    "download": {
      "bg": "system-bg",
      "fg": "dark-green",
      "fg-alt": "green"
    },
    "error": {
      "bg": "system-bg",
      "fg": "dark-red",
      "fg-alt": "red"
    },
    "fetching-metadata": {
      "bg": "system-bg",
      "fg": "dark-blue",
      "fg-alt": "blue"
    },
    "forced-download": {
      "bg": "system-bg",
      "fg": "dark-cyan",
      "fg-alt": "cyan"
    },
    "forced-upload": {
      "bg": "system-bg",
      "fg": "dark-cyan",
      "fg-alt": "cyan"
    },
    "missing-files": {
      "bg": "system-bg",
      "fg": "red",
      "fg-alt": "dark-red"
    },
    "moving": {
      "bg": "system-bg",
      "fg": "dark-green",
      "fg-alt": "green"
    },
    "paused-download": {
      "bg": "system-bg",
      "fg": "gray",
      "fg-alt": "dark-gray"
    },
    "paused-upload": {
      "bg": "system-bg",
      "fg": "gray",
      "fg-alt": "dark-gray"
    },
    "queued-checking": {
      "bg": "system-bg",
      "fg": "blue",
      "fg-alt": "dark-blue"
    },
    "queued-download": {
      "bg": "system-bg",
      "fg": "blue",
      "fg-alt": "dark-blue"
    },
    "queued-upload": {
      "bg": "system-bg",
      "fg": "blue",
      "fg-alt": "dark-blue"
    },
    "stalled-download": {
      "bg": "system-bg",
      "fg": "dark-yellow",
      "fg-alt": "gray"
    },
    "stalled-upload": {
      "bg": "system-bg",
      "fg": "dark-yellow",
      "fg-alt": "gray"
    },
    "unknown": {
      "bg": "system-bg",
      "fg": "dark-magenta",
      "fg-alt": "magenta"
    },
    "upload": {
      "bg": "system-bg",
      "fg": "dark-green",
      "fg-alt": "green"
    }
  }
}
